Scopus refine results values,,,,,,,,,,,,,,,,,,,,,,,,,
,,,,,,,,,,,,,,,,,,,,,,,,,
Your query : (TITLE-ABS-KEY(Archaeology) AND PUBYEAR > 1949 AND PUBYEAR < 2024),,,,,,,,,,,,,,,,,,,,,,,,,
,,,,,,,,,,,,,,,,,,,,,,,,,
,,,,,,,,,,,,,,,,,,,,,,,,,
Number of results : 64884,,,,,,,,,,,,,,,,,,,,,,,,,
,,,,,,,,,,,,,,,,,,,,,,,,,
OPEN ACCESS,,YEAR,,AUTHOR NAME,,SUBJECT AREA,,DOCUMENT TYPE,,PUBLICATION STAGE,,SOURCE TITLE,,KEYWORD,,AFFILIATION,,FUNDING SPONSOR,,COUNTRY,,SOURCE TYPE,,LANGUAGE,
All Open Access,18928,2023,3065,"Lawler, A.",107,Arts and Humanities,38889,Article,43868,final,64505,Journal Of Archaeological Science,2311,Archaeology,23495,CNRS Centre National de la Recherche Scientifique,1794,National Science Foundation,1875,United States,17171,Journal,51456,English,57694
Gold,7133,2022,3841,"Glascock, M.D.",94,Social Sciences,37508,Book Chapter,6255,aip,379,Quaternary International,1477,Archeology,8390,University College London,1130,European Research Council,832,United Kingdom,11078,Book,8486,Russian,1860
Hybrid Gold,2893,2021,4180,"Erlandson, J.M.",86,Earth and Planetary Sciences,11016,Review,5317,,,American Antiquity,1189,Human,5405,University of Oxford,1128,Horizon 2020 Framework Programme,750,Italy,4173,Conference Proceeding,2774,Spanish,1758
Bronze,4569,2020,3987,"Lasaponara, R.",80,Environmental Science,4513,Conference Paper,3803,,,Antiquity,1067,Article,4981,University of Cambridge,1064,Australian Research Council,617,France,4134,Book Series,1951,French,1329
Green,11531,2019,3966,"Masini, N.",80,Agricultural and Biological Sciences,3906,Book,2370,,,Plos One,944,Humans,4285,Russian Academy of Sciences,800,European Commission,573,Germany,4069,Trade Journal,211,German,780
,,2018,3688,"Balter, M.",77,Multidisciplinary,3851,Note,1239,,,Science,895,History,4212,Consejo Nacional de Investigaciones Científicas y Técnicas,715,National Natural Science Foundation of China,566,Spain,3782,Report,1,Italian,558
,,2017,3490,"Boivin, N.",76,Computer Science,3262,Editorial,766,,,World Archaeology,817,Archaeological Evidence,2971,The Australian National University,657,Seventh Framework Programme,548,Australia,3072,Undefined,5,Portuguese,393
,,2016,3541,"Evershed, R.P.",76,Medicine,3059,Short Survey,527,,,Nature,719,Priority Journal,2518,University of York,648,Deutsche Forschungsgemeinschaft,539,Russian Federation,2595,,,Chinese,300
,,2015,2936,"Rick, T.C.",68,Engineering,2987,Letter,353,,,Journal Of Archaeological Science Reports,602,Animals,2094,The University of Arizona,595,Arts and Humanities Research Council,456,Canada,2488,,,Czech,159
,,2014,2855,"Eren, M.I.",67,Physics and Astronomy,2030,Erratum,207,,,Proceedings Of The National Academy Of Sciences Of The United States Of America,590,Holocene,2011,Durham University,553,Social Sciences and Humanities Research Council of Canada,424,China,1967,,,Polish,134
,,2013,2797,"Fuller, D.Q.",64,"Biochemistry, Genetics and Molecular Biology",1945,Conference Review,138,,,Archaeometry,588,"History, Ancient",1882,Chinese Academy of Sciences,545,Natural Environment Research Council,418,Israel,1188,,,Romanian,123
,,2012,2790,"Kennett, D.J.",64,Chemistry,1373,Data Paper,37,,,American Journal Of Physical Anthropology,535,Artifact,1810,Consiglio Nazionale delle Ricerche,539,National Geographic Society,392,Netherlands,1185,,,Moldavian,113
,,2011,2319,"Boaretto, E.",63,Materials Science,1147,Retracted,3,,,International Journal Of Nautical Archaeology,525,Animal,1694,Oxford Social Sciences Division,516,Wenner-Gren Foundation,391,South Africa,1099,,,Moldovan,113
,,2010,2070,"Conard, N.J.",61,Mathematics,861,Report,1,,,Arkheologiia Evraziiskikh Stepei,491,Neolithic,1651,Museum National d'Histoire Naturelle,513,Leverhulme Trust,334,Sweden,1047,,,Croatian,83
,,2009,1833,"Collins, M.J.",59,"Business, Management and Accounting",566,,,,,International Journal Of Historical Archaeology,475,Nonhuman,1553,Consejo Superior de Investigaciones Científicas,512,Ministerio de Economía y Competitividad,315,Brazil,1028,,,Turkish,82
,,2008,1854,"Higham, T.",58,Energy,480,,,,,Geoarchaeology,445,United States,1502,"University of the Witwatersrand, Johannesburg",501,Ministerio de Ciencia e Innovación,292,Argentina,1018,,,Hungarian,78
,,2007,1531,"Ulm, S.",58,Psychology,457,,,,,Povolzhskaya Arkheologiya,440,Europe,1463,Eberhard Karls Universität Tübingen,492,Russian Foundation for Basic Research,279,Poland,1010,,,Slovenian,58
,,2006,1386,"Levy, T.E.",57,"Economics, Econometrics and Finance",435,,,,,Journal Of Human Evolution,437,Paleolithic,1435,University of Southampton,481,European Regional Development Fund,275,Belgium,939,,,Slovak,51
,,2005,1267,"Roberts, R.G.",57,Immunology and Microbiology,368,,,,,Radiocarbon,411,Bone,1411,Arizona State University,458,British Academy,257,Denmark,909,,,Japanese,43
,,2004,1160,"Carbonell, E.",55,Chemical Engineering,264,,,,,International Archives Of The Photogrammetry Remote Sensing And Spatial Information Sciences ISPRS Archives,393,Bronze Age,1364,"University of California, Berkeley",456,Leakey Foundation,219,Greece,877,,,Bosnian,42
,,2003,1084,"Domínguez-Rodrigo, M.",54,Neuroscience,219,,,,,Historical Archaeology,359,Radiocarbon Dating,1357,Harvard University,439,Japan Society for the Promotion of Science,213,Switzerland,852,,,Ukrainian,36
,,2002,920,"Roberts, P.",54,Decision Sciences,154,,,,,Quaternary Science Reviews,344,Male,1307,Smithsonian Institution,429,Max-Planck-Gesellschaft,210,Japan,767,,,Persian,34
,,2001,721,"Goldberg, P.",53,"Pharmacology, Toxicology and Pharmaceutics",142,,,,,Post Medieval Archaeology,315,Human Settlement,1239,Sapienza Università di Roma,428,Conselho Nacional de Desenvolvimento Científico e Tecnológico,205,Austria,761,,,Dutch,30
,,2000,645,"Insoll, T.",53,Nursing,85,,,,,Journal Of Field Archaeology,308,Female,1234,Max-Planck-Institut für Evolutionäre Anthropologie,415,Centre National de la Recherche Scientifique,202,Norway,737,,,Swedish,26
,,1999,517,"Kirch, P.V.",53,Health Professions,75,,,,,Archaeological Dialogues,307,Italy,1181,Universiteit Leiden,405,Agence Nationale de la Recherche,188,Czech Republic,661,,,catalan,25
,,1998,491,"Krause, J.",52,Veterinary,75,,,,,Latin American Antiquity,305,Pleistocene,1178,Université de Bordeaux,383,Horizon 2020,184,Mexico,635,,,Estonian,20
,,1997,484,"Buchanan, B.",51,Dentistry,74,,,,,Holocene,288,Fossil,1162,The University of Queensland,370,Israel Science Foundation,184,India,632,,,Arabic,12
,,1996,430,"Jacobs, Z.",51,Undefined,21,,,,,Journal Of Archaeological Method And Theory,283,Eurasia,1149,Universitat de Barcelona,366,Chinese Academy of Sciences,176,Turkey,615,,,Serbian,12
,,1995,347,"Petraglia, M.D.",51,,,,,,,Archaeologies,273,Paleoenvironment,1139,The University of Sydney,364,Russian Science Foundation,172,New Zealand,599,,,Kazakh,11
,,1994,305,"Agapiou, A.",50,,,,,,,Journal Of Anthropological Archaeology,273,Prehistoric,1111,University of Haifa,361,Generalitat de Catalunya,169,Portugal,596,,,Korean,10
,,1993,251,"Hublin, J.J.",50,,,,,,,Scientific Reports,265,Cultural Heritage,1058,Universidad Complutense de Madrid,360,Consejo Nacional de Investigaciones Científicas y Técnicas,151,Romania,523,,,Lithuanian,9
,,1992,238,"Sitdikov, A.G.",50,,,,,,,Archaeology Ethnology And Anthropology Of Eurasia,259,Chronology,1057,University of Toronto,358,Fundação para a Ciência e a Tecnologia,137,Chile,457,,,Norwegian,9
,,1991,220,"Bahain, J.J.",49,,,,,,,Archaeological And Anthropological Sciences,228,Fossils,1048,"De la Préhistoire à l'Actuel : Culture, Environnement et Anthropologie",350,"Directorate for Social, Behavioral and Economic Sciences",135,Ireland,431,,,Danish,8
,,1990,241,"Bar-Oz, G.",49,,,,,,,Oxford Journal Of Archaeology,228,Ceramics,1042,"University of California, Los Angeles",348,"Ministero dell’Istruzione, dell’Università e della Ricerca",127,Hungary,394,,,Latvian,7
,,1989,217,"Bar-Yosef, O.",49,,,,,,,Journal Of Archaeological Research,219,Remote Sensing,1007,"Siberian Branch, Russian Academy of Sciences",347,Nederlandse Organisatie voor Wetenschappelijk Onderzoek,127,Finland,374,,,Afrikaans,4
,,1988,200,"O'Brien, M.J.",49,,,,,,,Proceedings Of SPIE The International Society For Optical Engineering,216,Anthropology,1006,Faculty of Social Sciences &amp; Health,345,Narodowe Centrum Nauki,125,Kazakhstan,314,,,Finnish,3
,,1987,184,"Braje, T.J.",48,,,,,,,Journal Of Island And Coastal Archaeology,213,China,1001,Stanford University,343,H2020 Marie Skłodowska-Curie Actions,124,Croatia,255,,,Hebrew,3
,,1986,196,"Galili, E.",47,,,,,,,Southeastern Archaeology,204,Hominid,981,Aarhus Universitet,339,Coordenação de Aperfeiçoamento de Pessoal de Nível Superior,123,Egypt,234,,,Albanian,2
,,1985,187,"Pollard, A.M.",47,,,,,,,Ancient Mesoamerica,203,Cultural Anthropology,959,Aix Marseille Université,337,Natural Sciences and Engineering Research Council of Canada,122,Iran,230,,,Belarusian,2
,,1984,152,"Moncel, M.H.",45,,,,,,,Industrial Archaeology Review,202,Controlled Study,934,Universitat Rovira i Virgili,336,Fundação de Amparo à Pesquisa do Estado de São Paulo,120,South Korea,226,,,Greek,2
,,1983,173,"Shennan, S.",45,,,,,,,Archaeological Prospection,201,Animalia,910,Hebrew University of Jerusalem,335,Schweizerischer Nationalfonds zur Förderung der Wissenschaftlichen Forschung,120,Ukraine,219,,,Malay,2
,,1982,155,"Veth, P.",45,,,,,,,Environmental Archaeology,199,Agriculture,891,University of Florida,333,National Institutes of Health,116,Cyprus,203,,,Bulgarian,1
,,1981,155,"Finkelstein, I.",44,,,,,,,Arabian Archaeology And Epigraphy,191,Climate Change,869,Københavns Universitet,333,European Social Fund,110,Peru,198,,,Indonesian,1
,,1980,160,"Richards, M.P.",44,,,,,,,Journal Of Social Archaeology,191,Evolution,866,The University of Sheffield,329,Vetenskapsrådet,110,Slovenia,198,,,Irish Gaelic,1
,,1979,144,"David, B.",43,,,,,,,American Anthropologist,188,United Kingdom,862,University of Pennsylvania,325,National Endowment for the Humanities,108,Colombia,182,,,Undefined,98
,,1978,122,"Fitzpatrick, S.M.",43,,,,,,,Journal Of Mediterranean Archaeology,186,Adult,860,Universidade de São Paulo,321,Austrian Science Fund,102,Slovakia,156,,,,
,,1977,110,"Pinhasi, R.",43,,,,,,,European Journal Of Archaeology,184,Paleontology,851,Tel Aviv University,319,National Key Research and Development Program of China,98,Indonesia,150,,,,
,,1976,104,"Yravedra, J.",43,,,,,,,Kazakhstan Archeology,183,Excavation,848,Institute of Archaeology Russian Academy of Sciences,317,Agencia Nacional de Promoción Científica y Tecnológica,96,Jordan,145,,,,
,,1975,93,"Hofman, C.L.",42,,,,,,,Lecture Notes In Computer Science Including Subseries Lecture Notes In Artificial Intelligence And Lecture Notes In Bioinformatics,181,Iron Age,834,Instituto Catalán de Paleoecología Humana y Evolución Social,316,Engineering and Physical Sciences Research Council,96,Estonia,141,,,,
,,1974,83,"Craig, O.E.",41,,,,,,,Cambridge Archaeological Journal,178,Spain,833,Max Planck Institute for the Science of Human History,314,"Ministerio de Ciencia, Innovación y Universidades",95,Taiwan,139,,,,
,,1973,85,"Shipton, C.",41,,,,,,,Remote Sensing,169,Genetics,816,University of Exeter,312,National Aeronautics and Space Administration,95,Malaysia,134,,,,
,,1972,86,"Smith, M.E.",41,,,,,,,Norwegian Archaeological Review,160,Architecture,812,Universitat Autònoma de Barcelona,310,National Research Foundation,91,Saudi Arabia,117,,,,
,,1971,79,"Thompson, V.D.",41,,,,,,,Australian Archaeology,159,Procedures,787,University of Leicester,309,Agència de Gestió d'Ajuts Universitaris i de Recerca,89,Serbia,115,,,,
,,1970,93,"Alt, K.W.",40,,,,,,,African Archaeological Review,151,GIS,767,University of Reading,306,Norges Forskningsråd,89,Kenya,111,,,,
,,1969,65,"Edwards, H.G.M.",40,,,,,,,Asian Perspectives,146,Migration,760,Smithsonian National Museum of Natural History,303,UK Research and Innovation,88,Bulgaria,107,,,,
,,1968,62,"Hodder, I.",40,,,,,,,Internet Archaeology,146,Stratigraphy,756,Simon Fraser University,300,Consejo Nacional de Ciencia y Tecnología,87,Iceland,99,,,,
,,1967,59,"Madella, M.",40,,,,,,,Advances In Archaeological Practice,144,Note,740,University of Cape Town,295,Ministère de la Culture,87,United Arab Emirates,99,,,,
,,1966,40,"Renfrew, C.",40,,,,,,,Archaeological Reports,142,France,729,University of Missouri,291,National Office for Philosophy and Social Sciences,85,Lithuania,97,,,,
,,1965,32,"Shahack-Gross, R.",40,,,,,,,Archeological Papers Of The American Anthropological Association,142,Hominidae,729,University of Bristol,289,Wellcome Trust,81,Tanzania,97,,,,
,,1964,36,"Gao, X.",39,,,,,,,Annual Review Of Anthropology,138,Taphonomy,712,Universität Wien,287,"Institute of Archaeology, University College London",78,Singapore,82,,,,
,,1963,48,"Mercier, N.",39,,,,,,,Archaologisches Nachrichtenblatt,136,Tool Use,710,Universidad de Buenos Aires,282,National Park Service,78,Thailand,81,,,,
,,1962,38,"Talamo, S.",39,,,,,,,Journal Of Community Archaeology And Heritage,130,Chemistry,707,The University of Manchester,282,Royal Society,78,Morocco,73,,,,
,,1961,29,"Bourgeois, J.",38,,,,,,,Anthropologie France,128,Methodology,707,Flinders University,278,University of Cambridge,78,Panama,73,,,,
,,1960,23,"Falguères, C.",38,,,,,,,Heritage,125,Review,694,Sorbonne Université,274,Fondo Nacional de Desarrollo Científico y Tecnológico,75,Hong Kong,70,,,,
,,1959,32,"Funari, P.P.A.",38,,,,,,,Encyclopedia Of Archaeology,124,Africa,680,University of Bradford,274,Fonds Wetenschappelijk Onderzoek,74,Philippines,70,,,,
,,1958,21,"Gibbons, A.",38,,,,,,,Journal Of Maritime Archaeology,124,Landscape,678,Alma Mater Studiorum Università di Bologna,273,Grantová Agentura České Republiky,72,Tunisia,69,,,,
,,1957,18,"González-Ruibal, A.",38,,,,,,,Public Archaeology,121,Landscape Archaeology,678,Universiteit Gent,273,Eberhard Karls Universität Tübingen,71,Armenia,63,,,,
,,1956,19,"Hedges, R.E.M.",38,,,,,,,Arctic Anthropology,117,Diet,666,Pennsylvania State University,267,Alexander von Humboldt-Stiftung,70,Malta,58,,,,
,,1955,21,"Leucci, G.",38,,,,,,,Journal Of Radioanalytical And Nuclear Chemistry,117,Bone And Bones,663,University of Liverpool,261,"Ministry of Education, Culture, Sports, Science and Technology",70,Mongolia,58,,,,
,,1954,25,"Manning, S.W.",38,,,,,,,Open Archaeology,116,Material Culture,661,"University of Michigan, Ann Arbor",261,Russian Academy of Sciences,69,Georgia,57,,,,
,,1953,19,"Marean, C.W.",38,,,,,,,Complutum,115,Experimental Archaeology,660,The University of Edinburgh,261,Ministry of Education and Science of the Russian Federation,66,Ethiopia,54,,,,
,,1952,24,"Meskell, L.",38,,,,,,,Journal Of Contemporary Archaeology,114,Asia,650,University of Oregon,257,National Eye Research Centre,66,Bolivia,52,,,,
,,1951,23,"Neff, H.",38,,,,,,,Current Anthropology,113,Archaeological Site,638,The University of Western Australia,255,Smithsonian Institution,66,Lebanon,52,,,,
,,1950,22,"Braun, D.R.",37,,,,,,,Journal Of World Prehistory,112,Paleoclimate,637,Archéologies et Sciences de l’Antiquité,252,Danmarks Grundforskningsfond,65,Uruguay,52,,,,
,,,,"Chirikure, S.",37,,,,,,,Journal Of Quaternary Science,110,Photogrammetry,637,University of Glasgow,250,National Research Foundation of Korea,65,Nigeria,50,,,,
,,,,"Peresani, M.",37,,,,,,,Journal Of Cultural Heritage,109,Paleopathology,635,Texas A&amp;M University,249,University of Haifa,65,Pakistan,50,,,,
,,,,"Baquedano, E.",36,,,,,,,Archeologia Medievale,108,North America,624,Tatarstan Academy of Sciences,247,John Templeton Foundation,63,Uzbekistan,50,,,,
,,,,"Brown, A.G.",36,,,,,,,International Journal Of Osteoarchaeology,106,Technology,623,The University of New Mexico,246,University of Arizona,63,Viet Nam,49,,,,
,,,,"Higham, T.F.G.",36,,,,,,,Chungara,105,Ancient DNA,619,Universidad del Pais Vasco,244,"Ministerio de Educación, Cultura y Deporte",62,Algeria,48,,,,
,,,,"Holtorf, C.",36,,,,,,,Palaeogeography Palaeoclimatology Palaeoecology,105,Reconstruction,614,The University of Texas at Austin,243,Agencia Estatal de Investigación,61,Ecuador,47,,,,
,,,,"Iriarte, J.",36,,,,,,,Philosophical Transactions Of The Royal Society B Biological Sciences,103,Geoarchaeology,606,University of Colorado Boulder,242,Fundamental Research Funds for the Central Universities,61,Guatemala,47,,,,
,,,,"Larson, G.",36,,,,,,,Revista De Arqueologia,103,Egypt,586,University of Washington,241,U.S. Department of Energy,61,Qatar,47,,,,
,,,,"Liritzis, I.",36,,,,,,,One World Archaeology,102,Mesolithic,583,University of Wollongong,238,Bundesministerium für Bildung und Forschung,60,Venezuela,46,,,,
,,,,"Ollé, A.",36,,,,,,,Forensic Science International,100,Mass Spectrometry,582,Christian-Albrechts-Universität zu Kiel,235,"University of the Witwatersrand, Johannesburg",60,Iraq,45,,,,
,,,,"Rehren, T.",36,,,,,,,Evolutionary Anthropology,98,Cave,579,Deutsches Archäologisches Institut,231,Gerda Henkel Foundation,59,Cuba,40,,,,
,,,,"Reich, D.",36,,,,,,,Sustainability Switzerland,98,Settlement History,572,Uppsala Universitet,229,Harvard University,59,Azerbaijan,35,,,,
,,,,"Riede, F.",36,,,,,,,Current Swedish Archaeology,90,Skeleton,559,Universität zu Köln,227,Federación Española de Enfermedades Raras,58,Ghana,35,,,,
,,,,"Sarris, A.",36,,,,,,,Geoarchaeology An International Journal,90,Art,557,Università di Pisa,227,Fondation Fyssen,58,Latvia,33,,,,
,,,,"Wadley, L.",36,,,,,,,Kiva,90,DNA,552,Universidad Nacional Autónoma de México,227,Arizona State University,57,Moldova,33,,,,
,,,,"Doneus, M.",35,,,,,,,Geological Society Special Publication,89,Human Activity,552,Stockholms universitet,224,Ministry of Education and Science of the Republic of Kazakhstan,56,Syrian Arab Republic,32,,,,
,,,,"Feinman, G.M.",35,,,,,,,Interdisciplinary Contributions To Archaeology,89,Greece,550,Universitetet i Bergen,224,Institute for Aegean Prehistory,55,Albania,30,,,,
,,,,"Haak, W.",35,,,,,,,Archaeology In Oceania,88,Mitochondrial DNA,544,Institució Catalana de Recerca i Estudis Avançats,222,National Institute of General Medical Sciences,54,Oman,30,,,,
,,,,"Holliday, V.T.",35,,,,,,,International Journal Of Heritage Studies,88,Australia,543,Institute of Archaeology and Ethnography of the Siberian Branch of the Russian Academy of Sciences,217,Sapienza Università di Roma,53,Puerto Rico,30,,,,
,,,,"Kristiansen, K.",35,,,,,,,Mediterranean Archaeology And Archaeometry,88,Zooarchaeology,539,Newcastle University,215,China Postdoctoral Science Foundation,52,Sri Lanka,30,,,,
,,,,"Lyman, R.L.",35,,,,,,,Vegetation History And Archaeobotany,87,Historical Perspective,536,Università degli Studi di Firenze,214,Fonds De La Recherche Scientifique - FNRS,52,Zimbabwe,27,,,,
,,,,"Schiffer, M.B.",35,,,,,,,Azania,86,Geography,534,The University of Auckland,212,Academy of Finland,50,Cambodia,26,,,,
,,,,"Willerslev, E.",35,,,,,,,Quaternaire,86,Hunter-gatherer,526,La Trobe University,211,"Unitatea Executiva pentru Finantarea Invatamantului Superior, a Cercetarii, Dezvoltarii si Inovarii",50,Madagascar,26,,,,
,,,,"Douka, K.",34,,,,,,,Near Eastern Archaeology,85,Cultural Heritages,525,Université Paris 1 Panthéon-Sorbonne,211,Andrew W. Mellon Foundation,49,Greenland,23,,,,
,,,,"Díaz-Andreu, M.",34,,,,,,,Nuclear Instruments And Methods In Physics Research Section B Beam Interactions With Materials And Atoms,83,Middle Ages,521,The British Museum,205,Science and Technology Facilities Council,49,Guam,22,,,,
,,,,"Groucutt, H.S.",34,,,,,,,Kratkiye Soobshcheniya Instituta Arkheologii,80,Paleoecology,521,University of Birmingham,205,Generalitat Valenciana,48,Senegal,21,,,,
,,,,"Kuzmin, Y.V.",34,,,,,,,Medieval Archaeology,80,Physical Anthropology,511,University of Aberdeen,204,National Museum of Natural History,48,Bangladesh,20,,,,
,,,,"Petraglia, M.",34,,,,,,,Catena,79,Human Tissue,494,The University of Chicago,204,University College London,48,Bosnia and Herzegovina,20,,,,
,,,,"Spriggs, M.",34,,,,,,,Quaternary Research United States,79,Geology,491,Brown University,201,Australian Institute of Nuclear Science and Engineering,45,Sudan,20,,,,
,,,,"Arsuaga, J.L.",33,,,,,,,Trabajos De Prehistoria,78,Geochronology,489,"University of California, Santa Barbara",201,Department of Education and Training,45,Palestine,19,,,,
,,,,"Carson, M.T.",33,,,,,,,Anthropologie,77,Chemical Analysis,484,University of Wisconsin-Madison,200,China Scholarship Council,44,Papua New Guinea,19,,,,
,,,,"Culleton, B.J.",33,,,,,,,ISPRS Annals Of The Photogrammetry Remote Sensing And Spatial Information Sciences,76,Culture,481,Helsingin Yliopisto,199,Consejo Superior de Investigaciones Científicas,44,Botswana,18,,,,
,,,,"Degryse, P.",33,,,,,,,Stratum Plus,75,England,478,"Travaux et Recherches Archéologiques sur les Cultures, les Espaces et les Sociétés",199,Javna Agencija za Raziskovalno Dejavnost RS,44,Costa Rica,16,,,,
,,,,"Grün, R.",33,,,,,,,Archeologia E Calcolatori,74,Geomorphology,476,Centro Nacional de Investigación sobre la Evolución Humana CENIEH,198,University of York,44,Jamaica,16,,,,
,,,,"Murray, T.",33,,,,,,,Frontiers In Earth Science,74,Tooth,475,University of Chinese Academy of Sciences,197,"United Nations Educational, Scientific and Cultural Organization",43,Belize,15,,,,
,,,,"Neubauer, W.",33,,,,,,,Springerbriefs In Archaeology,74,Israel,471,Università degli Studi di Padova,196,Universiteit Gent,43,Kyrgyzstan,15,,,,
,,,,"Neves, E.G.",33,,,,,,,International Journal Of Phytoremediation,73,Cultural History,467,Institute of Vertebrate Paleontology and Paleoanthropology Chinese Academy of Sciences,195,University of Sydney,43,Namibia,15,,,,
,,,,"Reinhard, K.J.",33,,,,,,,Journal Of Conflict Archaeology,73,Surveys,463,KU Leuven,194,Euskal Herriko Unibertsitatea,42,Dominican Republic,14,,,,
,,,,"Rosell, J.",33,,,,,,,North American Archaeologist,72,Medieval,454,Kazan Federal University,194,Ministry of Education of the People's Republic of China,42,Luxembourg,14,,,,
,,,,"Voss, B.L.",33,,,,,,,Plains Anthropologist,72,Historical Geography,452,The University of British Columbia,190,PAST,42,Vanuatu,14,,,,
,,,,"Ward, I.",33,,,,,,,South African Archaeological Bulletin,71,Carbon,449,Université Toulouse - Jean Jaurès,188,University of California,42,Belarus,13,,,,
,,,,"Warinner, C.",33,,,,,,,Archeologicke Rozhledy,70,Turkey,443,University of Warsaw,188,University of California Berkeley,42,North Macedonia,13,,,,
,,,,"de la Torre, I.",33,,,,,,,Quaternary Geochronology,70,Research,439,Boston University,188,University of Oxford,42,Uganda,12,,,,
,,,,"Benjamin, J.",32,,,,,,,Arqueologia De La Arquitectura,69,Germany,437,Universidad de Granada,188,American Museum of Natural History,41,Cameroon,11,,,,
,,,,"Bevan, A.",32,,,,,,,Digital Applications In Archaeology And Cultural Heritage,69,Historical Archaeology,437,Ludwig-Maximilians-Universität München,185,American Philosophical Society,41,Gibraltar,11,,,,
,,,,"Bogaard, A.",32,,,,,,,Journal Of Applied Geophysics,69,Charcoal,436,Freie Universität Berlin,185,European Cooperation in Science and Technology,41,Mozambique,11,,,,
,,,,"Crowther, A.",32,,,,,,,Rossijskaja Arheologija,69,Religion,436,Universitat de València,184,Ministère des Affaires Etrangères,41,Laos,10,,,,
,,,,"Dalton, R.",32,,,,,,,Tel Aviv,69,Palynology,429,"Instituto Nacional de Antropología e Historia, Mexico",184,Universiteit Leiden,41,Myanmar,10,,,,
,,,,"Denham, T.",32,,,,,,,Virtual Archaeology Review,69,Radiometric Dating,429,Università degli Studi di Siena,183,Durham University,40,Nepal,10,,,,
,,,,"Hajdas, I.",32,,,,,,,Arqueologia Iberoamericana,68,Environmental Change,427,Monash University,183,Junta de Castilla y León,40,New Caledonia,10,,,,
,,,,"Kohler, T.A.",32,,,,,,,Comptes Rendus Palevol,67,Burial,424,Israel Antiquities Authority,182,Stanford University,40,Tajikistan,10,,,,
,,,,"McPherron, S.P.",32,,,,,,,American Journal Of Archaeology,66,Skull,423,"Faculty of Science, Medicine and Health",182,University of Auckland,40,Libyan Arab Jamahiriya,9,,,,
,,,,"O'Connor, S.",32,,,,,,,Proceedings Of The Royal Society B Biological Sciences,66,Heritage,422,University of Calgary,181,University of Cape Town,40,Mauritius,9,,,,
,,,,"Piperno, D.R.",32,,,,,,,Boletim Do Museu Paraense Emilio Goeldi Ciencias Humanas,65,Phylogeny,416,University of Hawaiʻi at Mānoa,176,University of Queensland,40,Zambia,9,,,,
,,,,"Blasco, R.",31,,,,,,,Land,65,Domestication,413,Washington University in St. Louis,175,British Institute in Eastern Africa,39,Bahrain,8,,,,
,,,,"Clarkson, C.",31,,,,,,,Archaeologia Historica,64,South America,413,Universitetet i Oslo,175,Carlsbergfondet,39,Benin,8,,,,
,,,,"Hamilakis, Y.",31,,,,,,,Time And Mind,63,Comparative Study,412,Academy of Sciences of the Czech Republic,174,Directorate for Geosciences,39,French Polynesia,8,,,,
,,,,"Mallol, C.",31,,,,,,,International Journal Of Paleopathology,62,Scanning Electron Microscopy,411,Polish Academy of Sciences,173,Fundação Carlos Chagas Filho de Amparo à Pesquisa do Estado do Rio de Janeiro,39,Gabon,8,,,,
,,,,"Morhange, C.",31,,,,,,,Conservation And Management Of Archaeological Sites,61,Demography,410,University of Otago,173,H2020 European Research Council,39,Kuwait,8,,,,
,,,,"Schofield, J.",31,,,,,,,Monthly Notices Of The Royal Astronomical Society,61,Provenance,410,University of Illinois Urbana-Champaign,172,Marie Curie,39,Yemen,8,,,,
,,,,"Shin, D.H.",31,,,,,,,Arqueologia,60,"History, Medieval",404,University of Georgia,172,University of Michigan,39,Bahamas,7,,,,
,,,,"Thomas, M.G.",31,,,,,,,Archaologisches Korrespondenzblatt,59,Physiology,401,Rijksuniversiteit Groningen,171,University of Toronto,39,Monaco,7,,,,
,,,,"Valladas, H.",31,,,,,,,Proceedings Of The Prehistoric Society,59,Anthropogenic Effect,392,Indiana University Bloomington,171,Australian National University,38,Montenegro,7,,,,
