,,,,"Weiner, S.",31,,,,,,,Antiquaries Journal,58,Carbon 14,387,ARC Centre of Excellence for Australian Biodiversity and Heritage,171,Canada Foundation for Innovation,38,Angola,6,,,,
,,,,"Barkai, R.",30,,,,,,,Vestnik Novosibirskogo Gosudarstvennogo Universiteta Seriya Istoriya Filologiya,58,Pottery,385,Yale University,169,"Ministerstvo Školství, Mládeže a Tělovýchovy",38,Fiji,6,,,,
,,,,"Benazzi, S.",30,,,,,,,Geomorphology,57,Stable Isotope,385,"University of California, Davis",169,Schweizerischer Nationalfonds zur F&#x00F6;rderung der Wissenschaftlichen Forschung,38,Libya,6,,,,
,,,,"Bradley, D.G.",30,,,,,,,Journal Of Forensic Sciences,57,Geochemistry,382,Cornell University,168,Tanzania Commission for Science and Technology,38,Malawi,6,,,,
,,,,"Collard, M.",30,,,,,,,Prahistorische Zeitschrift,57,Geophysics,382,Universidad Autónoma de Madrid,168,University of Southampton,38,Mali,6,,,,
,,,,"Haslam, M.",30,,,,,,,Science Of The Total Environment,57,South Africa,382,Bournemouth University,167,Eesti Teadusagentuur,37,Trinidad and Tobago,6,,,,
,,,,"Horwitz, L.K.",30,,,,,,,Journal Of Anthropological Research,56,Population Genetics,380,"University of California, San Diego",164,Foundation for the Advancement of Mesoamerican Studies,37,Andorra,5,,,,
,,,,"Lycett, S.J.",30,,,,,,,Forensic Archaeology A Global Perspective,55,Mammalia,375,The Ohio State University,163,Simon Fraser University,37,Bermuda,5,,,,
,,,,"Marwick, B.",30,,,,,,,Hortus Artium Mediaevalium,55,Sediment,375,Peking University,163,Canada Research Chairs,36,Cote d'Ivoire,5,,,,
,,,,"Petchey, F.",30,,,,,,,Journal Of African Archaeology,54,Short Survey,374,Università degli Studi di Napoli Federico II,160,Flinders University,36,El Salvador,5,,,,
,,,,"Saidin, M.",30,,,,,,,Arctic,53,Three Dimensional Computer Graphics,374,Queen's University Belfast,160,Narodowym Centrum Nauki,36,French Guiana,5,,,,
,,,,"Stello, D.",30,,,,,,,International Encyclopedia Of The Social Behavioral Sciences Second Edition,53,Virtual Reality,374,Griffith University,158,Università degli Studi di Padova,36,Honduras,5,,,,
,,,,"Zilhão, J.",30,,,,,,,Scottish Archaeological Journal,53,Middle East,372,New York University,155,Consiglio Nazionale delle Ricerche,35,Macao,5,,,,
,,,,"Barker, G.",29,,,,,,,Palestine Exploration Quarterly,52,Preservation,370,University of Alberta,154,"Department of Anthropology, McMaster University",35,Mauritania,5,,,,
,,,,"Liu, L.",29,,,,,,,Quaternary Research,52,Caves,368,Washington State University Pullman,153,FP7 People: Marie-Curie Actions,35,Eritrea,4,,,,
,,,,"Marriner, N.",29,,,,,,,Ceur Workshop Proceedings,51,Conservation,368,The University of Utah,153,Ministero degli Affari Esteri e della Cooperazione Internazionale,35,Faroe Islands,4,,,,
,,,,"Mercuri, A.M.",29,,,,,,,Proceedings Of The Geologists Association,51,Ground Penetrating Radar,367,University of Nottingham,149,Alphawood Foundation,34,Samoa,4,,,,
,,,,"Orser, C.E.",29,,,,,,,Special Paper Of The Geological Society Of America,51,Occupation,366,Cardiff University,148,Hebrew University of Jerusalem,34,Yugoslavia,4,,,,
,,,,"Pérez-González, A.",29,,,,,,,Applied Radiation And Isotopes,50,Skeletal Remains,366,University of Ferrara,148,Junta de Andalucía,34,Afghanistan,3,,,,
,,,,"Ramsey, C.B.",29,,,,,,,Handbook Of Landscape Archaeology,50,Population Dynamics,363,Lunds Universitet,148,Society of Antiquaries of London,34,American Samoa,3,,,,
,,,,"Scardozzi, G.",29,,,,,,,Interdisciplinaria Archaeologica,50,"DNA, Mitochondrial",361,Southern Methodist University,146,U.S. Department of Health and Human Services,34,Brunei Darussalam,3,,,,
,,,,"Torrence, R.",29,,,,,,,Archaeological Research In Asia,49,Land Use,360,James Cook University,146,University of Western Australia,34,Congo,3,,,,
,,,,Undefined,889,,,,,,,Undefined,65,Morphology,360,Columbia University,146,Undefined,49543,Undefined,6689,,,,
